{
  "schemaVersion": "1.0.0",
  "suiteId": "format-fixtures",
  "generatedAt": "2000-01-01T00:00:00Z",
  "baselines": [
    {
      "caseId": "bibliography-citation-edge-cases",
      "templateId": "format-fixture",
      "templateVersion": "1.0.0",
      "documentId": "bibliography-citation-edge-cases",
      "snapshotPath": "bibliography-citation-edge-cases.snapshot.txt",
      "layoutSignaturePath": "bibliography-citation-edge-cases.layout.json",
      "inspectPath": "bibliography-citation-edge-cases.inspect.json",
      "structureDiffPolicy": "failOnBreaking",
      "layoutThreshold": 0.99,
      "allowedDiffCategories": [],
      "forbiddenDiffCategories": [],
      "lastUpdatedAt": "2000-01-01T00:00:00Z",
      "notes": "Format fixture baseline."
    },
    {
      "caseId": "cover-declaration-edge-cases",
      "templateId": "cover-declaration-edge-cases",
      "templateVersion": "1.0.0",
      "documentId": "cover-declaration-edge-cases",
      "snapshotPath": "cover-declaration-edge-cases.snapshot.txt",
      "layoutSignaturePath": "cover-declaration-edge-cases.layout.json",
      "inspectPath": "cover-declaration-edge-cases.inspect.json",
      "structureDiffPolicy": "failOnBreaking",
      "layoutThreshold": 0.99,
      "allowedDiffCategories": [],
      "forbiddenDiffCategories": [],
      "lastUpdatedAt": "2000-01-01T00:00:00Z",
      "notes": "Format fixture baseline."
    },
    {
      "caseId": "figure-equation-crossref-edge-cases",
      "templateId": "format-fixture",
      "templateVersion": "1.0.0",
      "documentId": "figure-equation-crossref-edge-cases",
      "snapshotPath": "figure-equation-crossref-edge-cases.snapshot.txt",
      "layoutSignaturePath": "figure-equation-crossref-edge-cases.layout.json",
      "inspectPath": "figure-equation-crossref-edge-cases.inspect.json",
      "structureDiffPolicy": "failOnBreaking",
      "layoutThreshold": 0.99,
      "allowedDiffCategories": [],
      "forbiddenDiffCategories": [],
      "lastUpdatedAt": "2000-01-01T00:00:00Z",
      "notes": "Format fixture baseline."
    },
    {
      "caseId": "header-footer-edge-cases",
      "templateId": "format-fixture",
      "templateVersion": "1.0.0",
      "documentId": "header-footer-edge-cases",
      "snapshotPath": "header-footer-edge-cases.snapshot.txt",
      "layoutSignaturePath": "header-footer-edge-cases.layout.json",
      "inspectPath": "header-footer-edge-cases.inspect.json",
      "structureDiffPolicy": "failOnBreaking",
      "layoutThreshold": 0.99,
      "allowedDiffCategories": [],
      "forbiddenDiffCategories": [],
      "lastUpdatedAt": "2000-01-01T00:00:00Z",
      "notes": "Format fixture baseline."
    },
    {
      "caseId": "heading-numbering-edge-cases",
      "templateId": "format-fixture",
      "templateVersion": "1.0.0",
      "documentId": "heading-numbering-edge-cases",
      "snapshotPath": "heading-numbering-edge-cases.snapshot.txt",
      "layoutSignaturePath": "heading-numbering-edge-cases.layout.json",
      "inspectPath": "heading-numbering-edge-cases.inspect.json",
      "structureDiffPolicy": "failOnBreaking",
      "layoutThreshold": 0.99,
      "allowedDiffCategories": [],
      "forbiddenDiffCategories": [],
      "lastUpdatedAt": "2000-01-01T00:00:00Z",
      "notes": "Format fixture baseline."
    },
    {
      "caseId": "pagination-edge-cases",
      "templateId": "format-fixture",
      "templateVersion": "1.0.0",
      "documentId": "pagination-edge-cases",
      "snapshotPath": "pagination-edge-cases.snapshot.txt",
      "layoutSignaturePath": "pagination-edge-cases.layout.json",
      "inspectPath": "pagination-edge-cases.inspect.json",
      "structureDiffPolicy": "failOnBreaking",
      "layoutThreshold": 0.99,
      "allowedDiffCategories": [],
      "forbiddenDiffCategories": [],
      "lastUpdatedAt": "2000-01-01T00:00:00Z",
      "notes": "Format fixture baseline."
    },
    {
      "caseId": "table-edge-cases",
      "templateId": "format-fixture",
      "templateVersion": "1.0.0",
      "documentId": "table-edge-cases",
      "snapshotPath": "table-edge-cases.snapshot.txt",
      "layoutSignaturePath": "table-edge-cases.layout.json",
      "inspectPath": "table-edge-cases.inspect.json",
      "structureDiffPolicy": "failOnBreaking",
      "layoutThreshold": 0.99,
      "allowedDiffCategories": [],
      "forbiddenDiffCategories": [],
      "lastUpdatedAt": "2000-01-01T00:00:00Z",
      "notes": "Format fixture baseline."
    }
  ]
}